{
  "$schema": "https://json-schema.org/draft/2020-12/schema",
  "title": "autoframe plan",
  "type": "object",
  "properties": {
    "schema_version": {
      "const": 1
    },
    "project_id": {
      "type": "string",
      "minLength": 1
    },
    "objective": {
      "type": "string",
      "minLength": 1
    },
    "scope": {
      "type": "array",
      "items": {
        "type": "string",
        "minLength": 1
      },
      "minItems": 1
    },
    "non_goals": {
      "type": "array",
      "items": {
        "type": "string",
        "minLength": 1
      },
      "minItems": 0
    },
    "constraints": {
      "type": "array",
      "items": {
        "type": "string",
        "minLength": 1
      },
      "minItems": 0
    },
    "completion_criteria": {
      "type": "array",
      "items": {
        "type": "object",
        "properties": {
          "id": {
            "type": "string",
            "minLength": 1
          },
          "condition": {
            "type": "string",
            "minLength": 1
          },
          "verification": {
            "type": "string",
            "minLength": 1
          }
        },
        "required": [
          "id",
          "condition",
          "verification"
        ],
        "additionalProperties": false
      },
      "minItems": 1
    },
    "work_scope": {
      "type": "array",
      "items": {
        "type": "string",
        "minLength": 1
      },
      "minItems": 0
    },
    "input_scope": {
      "type": "array",
      "items": {
        "type": "string",
        "minLength": 1
      },
      "minItems": 0
    },
    "generated_scope": {
      "type": "array",
      "items": {
        "type": "string",
        "minLength": 1
      },
      "minItems": 0
    },
    "environment_checks": {
      "type": "array",
      "items": {
        "type": "string",
        "minLength": 1
      },
      "minItems": 0
    },
    "references": {
      "type": "array",
      "items": {
        "type": "object",
        "properties": {
          "path": {
            "type": "string",
            "minLength": 1
          },
          "purpose": {
            "type": "string",
            "minLength": 1
          }
        },
        "required": [
          "path",
          "purpose"
        ],
        "additionalProperties": false
      },
      "minItems": 0
    },
    "tasks": {
      "type": "array",
      "items": {
        "type": "object",
        "properties": {
          "id": {
            "type": "string",
            "minLength": 1
          },
          "description": {
            "type": "string",
            "minLength": 1
          },
          "required": {
            "type": "boolean"
          },
          "depends_on": {
            "type": "array",
            "items": {
              "type": "string",
              "minLength": 1
            },
            "minItems": 0
          },
          "criterion_ids": {
            "type": "array",
            "items": {
              "type": "string",
              "minLength": 1
            },
            "minItems": 0
          },
          "acceptance": {
            "type": "string",
            "minLength": 1
          },
          "verification": {
            "type": "string",
            "minLength": 1
          }
        },
        "required": [
          "id",
          "description",
          "required",
          "depends_on",
          "criterion_ids",
          "acceptance",
          "verification"
        ],
        "additionalProperties": false
      },
      "minItems": 0
    },
    "milestones": {
      "type": "array",
      "items": {
        "type": "object",
        "properties": {
          "id": {
            "type": "string",
            "minLength": 1
          },
          "description": {
            "type": "string",
            "minLength": 1
          },
          "task_ids": {
            "type": "array",
            "items": {
              "type": "string",
              "minLength": 1
            },
            "minItems": 0
          },
          "acceptance": {
            "type": "string",
            "minLength": 1
          }
        },
        "required": [
          "id",
          "description",
          "task_ids",
          "acceptance"
        ],
        "additionalProperties": false
      },
      "minItems": 0
    }
  },
  "required": [
    "schema_version",
    "project_id",
    "objective",
    "scope",
    "non_goals",
    "constraints",
    "completion_criteria",
    "work_scope"
  ],
  "additionalProperties": false
}
