{"completion_criteria":[{"condition":"SPEC.md \u00A71\u201322\u3001A.1\u2013A.15\u3001F.1\u2013F.9 \u306E\u5168\u5FC5\u9808\u898F\u5247\u30FB\u7981\u6B62\u30FB\u5B9F\u88C5\u4E0A\u306E\u4E0D\u5909\u6761\u4EF6\u30FB\u8981\u6C42\u691C\u8A3C\u3092\u6709\u9650\u306E\u4E00\u89A7\u306B\u3057\u3001\u5168\u9805\u76EE\u3092 task\u30FB\u691C\u8A3C\u3078\u5BFE\u5FDC\u4ED8\u3051\u308B\u3002doc \u53C2\u7167\u5148\u306E\u307F\u306E\u8981\u4EF6\u3001\u672A\u78BA\u5B9A\u90E8\u5206\u3001\u975E\u898F\u7BC4\u90E8\u5206\u306E\u9664\u5916\u6839\u62E0\u3092\u533A\u5225\u3059\u308B\u3002","id":"C01","verification":"\u5404\u898B\u51FA\u3057\u3068\u305D\u306E\u4E0B\u306E\u672C\u6587\u30FB\u8868\u30FB\u7B87\u6761\u66F8\u304D\u3092\u9806\u306B\u7167\u5408\u3057\u3001\u5B89\u5B9A\u3057\u305F\u7BC0/\u9805\u76EE\u8B58\u5225\u5B50\u3001\u5FC5\u9808\u6027\u3001\u62C5\u5F53 task\u3001\u691C\u8A3C\u6BB5\u968E\u30FB\u671F\u5F85\u7D50\u679C\u3092 STATUS.md \u306E\u5BFE\u5FDC\u8868\u307E\u305F\u306F\u5B9F\u884C\u8A18\u9332\u3067\u78BA\u8A8D\u3059\u308B\u3002\u5FC5\u9808\u306E\u672A\u5BFE\u5FDC\u30FB\u672A\u5B9F\u88C5\u30FB\u672A\u691C\u8A3C\u30920\u4EF6\u306B\u3059\u308B\u3002"},{"condition":"\u00A72\u30FB\u00A719\u30FBA.1\u20132/A.6\u30FBF \u306E\u78BA\u5B9A\u69CB\u6587\u3001source identity\u3001Unicode/\u5B57\u53E5\u3001literal\u3001\u6761\u4EF6\u9078\u629E\u3001\u69CB\u6587\u5F80\u5FA9\u30FB\u8A3A\u65AD\u3092\u5B9F\u88C5\u3059\u308B\u3002","id":"C02","verification":"\u65E2\u5B58 Lexing/Parsing/Source/Directive/Serialization \u30C6\u30B9\u30C8\u3092\u518D\u5229\u7528\u3057\u3001\u6B63\u8CA0\u4F8B\u3001\u4F4D\u7F6E\u3001source isolation\u3001parse/write/parse\u30FB\u4FDD\u5B58/\u518D\u8AAD\u8FBC\u3001literal \u306E exact \u5024\u3001\u9078\u629E/\u975E\u9078\u629E\u5883\u754C\u3092\u7167\u5408\u3059\u308B\u3002"},{"condition":"\u00A73\u30FB\u00A76\u30FB\u00A78\u201310 \u306E Type/Symbol/access/Contract/\u63A8\u8AD6/\u7279\u6B8A\u5316\u898F\u5247\u3068 A.3/A.11/A.12 \u306E\u4FDD\u6301\u30FB\u8A3C\u660E\u8981\u4EF6\u3092\u6E80\u305F\u3059\u3002","id":"C03","verification":"Binding \u306E\u6B63\u8CA0\u4F8B\u3068\u9806\u5E8F\u5165\u66FF\u3001generic \u5B9A\u7FA9\u6642/\u4F7F\u7528\u6642\u306E\u691C\u67FB\u3001\u518DBind/\u4F9D\u5B58\u5909\u66F4\u6642\u306E\u5931\u52B9\u3092\u78BA\u8A8D\u3059\u308B\u3002Unknown \u3084\u672A\u89E3\u6C7A\u7FA9\u52D9\u3092\u6210\u529F\u6271\u3044\u305B\u305A\u3001\u9078\u629E\u5F8C\u306E\u6240\u6709\u6A29\u5931\u6557\u306B\u3088\u308B\u5019\u88DC fallback \u304C\u306A\u3044\u3002"},{"condition":"\u00A77\u30FB\u00A711\u30FB\u00A712.4 \u306E\u95A2\u6570\u30FBdefault\u30FBreceiver\u30FBProperty\u30FBconstructor\u30FBcallable\u30FB\u52B9\u679C\u898F\u5247\u3092\u5B9F\u88C5\u3059\u308B\u3002","id":"C04","verification":"\u5F15\u6570\u8A55\u4FA1/\u53D6\u5F97\u9806\u3001getter/setter/\u521D\u56DE\u914D\u7F6E\u3001capture/call \u306E\u5206\u96E2\u3001receiver \u3054\u3068\u306E\u516C\u958B\u4FDD\u8A3C\u3001\u76F4\u63A5/\u9593\u63A5/generic call \u3068\u6B63\u5E38 cleanup \u306E\u610F\u5473\u30FB\u5B9F\u884C\u7D50\u679C\u3092\u78BA\u8A8D\u3059\u308B\u3002"},{"condition":"\u00A73.1\u30FB\u00A712\u201313 \u306E\u5B9F\u884C\u53EF\u80FD\u306A scalar/literal/\u6587\u5B57\u5217/\u5909\u63DB/\u6F14\u7B97/\u4EE3\u5165\u3092\u5B9F\u88C5\u3057\u3001\u62C5\u5F53\u7BC0\u304C\u7981\u6B62\u3059\u308B\u64CD\u4F5C\u306F\u62D2\u5426\u3059\u308B\u3002","id":"C05","verification":"\u578B\u306E\u5168\u5BFE\u8C61\u65B9\u5411\u3001\u6570\u5024\u5883\u754C\u30FBNaN/\u00B10/subnormal\u30FBUTF-8/NUL\u30FB\u8A55\u4FA1\u9806\u30FB\u7BC4\u56F2\u5916 Abort \u3092 managed \u3068 O0/O2 \u3067\u691C\u8A3C\u3059\u308B\u3002\u521D\u671F profile \u7981\u6B62\u306E i128 \u9664\u7B97\u7B49\u3068\u672A\u78BA\u5B9A\u306E string \u9023\u7D50\u306F\u62D2\u5426\u3092\u78BA\u8A8D\u3059\u308B\u3002"},{"condition":"\u00A73.4\u20133.7\u30FB\u00A715\u201316 \u306E\u521D\u671F\u5316/\u90E8\u5206Move/Origin/Loan/cleanup/deinit \u3092\u6E80\u305F\u3059\u3002","id":"C06","verification":"Place overlap\u3001\u623B\u308A\u53C2\u7167\u30FB\u4FDD\u5B58\u30FBreborrow\u30FBcapture/\u6D88\u53BB\u4F9D\u5B58\u3001CFG join/loop\u3001\u9014\u4E2D\u69CB\u7BC9/\u7F6E\u63DB\u3001\u9006\u8AD6\u7406\u9806\u306E\u7834\u68C4\u3068\u975E\u7D42\u4E86 cleanup \u3092\u6B63\u8CA0\u4F8B\u304A\u3088\u3073\u5B9F\u884C\u6642\u306E\u53D6\u5F97/\u7834\u68C4\u89B3\u6E2C\u3067\u78BA\u8A8D\u3059\u308B\u3002"},{"condition":"\u00A714\u30FB\u00A717\u30FBA.9/A.10/A.15 \u306E\u5236\u5FA1\u30D5\u30ED\u30FC\u3001Pattern/guard\u3001refinement\u3001require\u3001Option/Result\u3001Abort\u3001\u5FC5\u9808\u8B66\u544A\u3092\u5B9F\u88C5\u3059\u308B\u3002","id":"C07","verification":"\u69CB\u9020\u4E0A\u306E\u5B8C\u4E86\u3068\u5B9F\u884C\u5230\u9054\u306E\u5206\u96E2\u3001\u5168 Pattern \u5883\u754C\u3001\u7D50\u679C\u78BA\u4FDD\u2192cleanup\u2192\u914D\u9001\u3001Never/\u672A\u5230\u9054\u3082\u542B\u3080\u691C\u67FB\u3001\u8A3A\u65AD\u4F4D\u7F6E\u30FB\u5FC5\u9808\u8B66\u544A\u3068\u6291\u5236\u512A\u5148\u9806\u4F4D\u3092\u78BA\u8A8D\u3057\u3001O0/O2 \u306E\u89B3\u6E2C\u7D50\u679C\u3092\u6BD4\u8F03\u3059\u308B\u3002"},{"condition":"\u00A74\u30FB\u00A712.3.4\u30FB\u00A714.6\u30FB\u00A722.1 \u306E\u56FA\u5B9A\u914D\u5217\u30FBArray\u30FBDictionary\u30FBIndex\u30FBRange\u30FBResolvedRange\u30FBSlice\u30FB\u53CD\u5FA9\u306E\u78BA\u5B9A\u5951\u7D04\u3092\u5B9F\u88C5\u3059\u308B\u3002","id":"C08","verification":"A.12/A.13 \u306E length/stride/\u5883\u754C/\u90E8\u5206Move/\u5171\u6709\u8AAD\u53D6\u3001\u52D5\u7684\u66F4\u65B0\u306E\u53D6\u5F97\u30FBcommit\u30FB\u5BB9\u91CF\u30FB\u5931\u6557\u30FB\u7834\u68C4\u9806\u30FB\u4FDD\u6301Loan\u3001\u6C38\u4E45\u67AF\u6E07 iterator \u3068 element Type \u3092\u691C\u8A3C\u3057\u3001\u5B9F\u884C\u3067\u304D\u308B source \u64CD\u4F5C\u306F native \u307E\u3067\u78BA\u8A8D\u3059\u308B\u3002"},{"condition":"\u00A73.2.2/3.3\u30FB\u00A712.4.4\u30FB\u00A713.5.7\u20139/13.6.1\u30FB\u00A715.8\u30FB\u00A721.2 \u306E\u78BA\u5B9A object/Weak/metadata/\u52D5\u7684\u578B\u898F\u5247\u3092\u5B9F\u88C5\u3059\u308B\u3002","id":"C09","verification":"makeObj/makeRc/makeArc/clone/downgrade/upgrade/cyclic\u3001\u540C\u4E00\u6027\u30FBcount\u30FBBorrow\u30FB\u7834\u68C4\u3001static upcast/runtime is\u3001Building/Alive/Destroying/Freed \u3092\u691C\u8A3C\u3059\u308B\u3002arc \u306E\u9806\u5E8F\u8A3C\u660E\u3092 IR/native \u8A66\u9A13\u3068\u5206\u3051\u3066\u8A18\u9332\u3057\u3001\u672A\u5C0E\u5165\u306E Contract View/cast \u69CB\u6587\u3092\u8FFD\u52A0\u3057\u306A\u3044\u3002"},{"condition":"\u00A718\u30FB\u00A720.1\u20137\u30FB\u00A721.3.4 \u3068 A.1/A.3 \u306E module/source/\u69CB\u6210/Mod/\u610F\u5473\u60C5\u5831\u4FDD\u6301\u30FB\u518D\u5229\u7528\u5951\u7D04\u3092\u3001SPEC.md \u672C\u6587\u3067\u5B9A\u7FA9\u3055\u308C\u305F\u7BC4\u56F2\u3067\u5B9F\u88C5\u3059\u308B\u3002","id":"C10","verification":"source \u518D\u69CB\u7BC9\u3001\u76F4\u63A5\u4F9D\u5B58\u3068\u975E\u516C\u958B\u74B0\u5883\u306E\u4FDD\u6301\u3001\u518D\u5229\u7528/\u5931\u52B9\u3001Mod graph\u30FB\u4E00\u56DE\u5B9F\u884C\u30FBappend \u5883\u754C\u30FB\u9806\u5E8F/\u53D6\u6D88/\u5931\u6557\u30FB\u51FA\u529B\u9664\u53BB\u3092\u691C\u8A3C\u3059\u308B\u3002\u672A\u78BA\u5B9A\u306E\u5916\u90E8 binary \u4EA4\u63DB\u5F62\u5F0F\u3084 doc \u7531\u6765\u306E composition/test \u63A5\u7D9A\u3092\u524D\u63D0\u306B\u3057\u306A\u3044\u3002"},{"condition":"\u00A721.3\u30FB\u00A721.4.6 \u306E generic \u5171\u6709/\u7279\u6B8A\u5316\u3001context/schema\u3001resource limit\u3001\u56FA\u5B9A scratch frame \u3068 A.12/A.14 \u306E\u898F\u7BC4\u8981\u4EF6\u3092\u6E80\u305F\u3059\u3002","id":"C11","verification":"\u4E88\u7B970\u3092\u542B\u3080\u9078\u629E\u3001\u5FC5\u9808\u7279\u6B8A\u5316\u3001\u6709\u9650\u518D\u5E30/\u5897\u5927key\u3001\u5168Type/length/Origin\u306B\u4F9D\u5B58\u3059\u308B\u30AD\u30FC\u3001entry/adaptor/cleanup \u306E\u4E00\u81F4\u3001\u5165\u529B\u9806\u5E8F\u30FBcache\u6709\u7121\u30FB\u4E88\u7B97\u5909\u66F4\u3067\u306E\u610F\u5473\u4E0D\u5909\u3092\u78BA\u8A8D\u3059\u308B\u3002\u672A\u77E5\u7F6E\u63DB\u306E\u52D5\u7684 scratch \u3078\u306E fallback \u306F\u5C0E\u5165\u3057\u306A\u3044\u3002"},{"condition":"\u00A721.1\u20135 \u306E layout\u30FBmetadata\u30FB\u5185\u90E8ABI\u30FBchecked lowering\u30FBWindows x64 profile \u3092\u6E80\u305F\u3059\u3002","id":"C12","verification":"A.14 \u306E layout/ABI/CFG/\u5B9A\u6570/FP/frame/unwind/symbol \u306E\u5404\u691C\u8A3C\u9818\u57DF\u3092\u5BFE\u5FDC\u4ED8\u3051\u3001Clang \u306E C layout \u6BD4\u8F03\u3001\u6700\u9069\u5316\u524D\u5F8C verifier\u3001COFF/\u9006\u30A2\u30BB\u30F3\u30D6\u30EB/\u4F9D\u5B58\u30FBO0/O2 \u5B9F\u884C\u3092\u78BA\u8A8D\u3059\u308B\u3002LLVM Writer \u304C\u672A\u691C\u8A3C AST \u3092\u518D\u89E3\u91C8\u3057\u306A\u3044\u3002"},{"condition":"\u00A75\u30FB\u00A722 \u306E\u5168\u5FC5\u9808 Core \u5BA3\u8A00\u3001startup/static\u3001FFI\u3001console/runtime \u3068 raw pointer \u306E\u78BA\u5B9A\u64CD\u4F5C\u3092\u5B9F\u88C5\u3059\u308B\u3002","id":"C13","verification":"Core \u306E\u4E0D\u8DB3/\u507D\u88C5/\u4E92\u63DB\u6027\u3092\u691C\u67FB\u3057\u3001startup \u5019\u88DC\u30FBstatic cycle/shutdown\u3001C ABI \u5168\u8A31\u53EF\u578B\u30FB5\u5F15\u6570\u4EE5\u4E0A\u3001pointer \u306E\u5408\u6CD5\u5883\u754C\u3001runtime \u6545\u969C\u6CE8\u5165\u3092\u691C\u8A3C\u3059\u308B\u3002Hello \u306F\u30A2\u30D7\u30EA\u81EA\u8EAB\u306E14 UTF-8 byte\u3001\u7A7Astderr\u3001exit 0\u3001Abort \u306F exit 1 \u3092\u78BA\u8A8D\u3059\u308B\u3002"},{"condition":"\u00A720.8 \u306E emit-llvm/build/run\u3001Library inspection\u3001manifest/\u516C\u958B\u30FBtoolchain/backend \u306E\u898F\u5B9A\u3092\u6E80\u305F\u3059\u3002","id":"C14","verification":"emit \u306E LLVM \u4E0D\u8981\u6027\u3001.ll/.link.json hash\u3001Library \u306E pre-opt body \u3068 object \u751F\u6210\u3001\u901A\u5E38 Application build/run\u3001\u5931\u6557\u5F8C\u306E\u65E7\u6210\u529F\u7121\u52B9\u5316\u3001\u5B9F tool/library identity\u3001\u672A\u56FA\u5B9A\u7248/ABI/hash\u4E0D\u4E00\u81F4\u306E\u62D2\u5426\u3092\u78BA\u